Abstract #,Abstract Title,Date,Time,Location,URL,Authors,Authors Affiliations,Abstract Text,Category,Sub Category,Session TitleP2-287,Insomnia Increases the Risk of Alzheimer’s Disease and Vascular Dementia: A Nationwide Population-Based Study in South Korea,"Mon, Jul 15  (Pacific)",9:30am - 4:15pm,South Hall GH - Los Angeles Convention Center,https://ep70.eventpilotadmin.com/web/page.php?page=Session&project=AAIC19&id=30501,"Min seok Baek, MD",,"
Abstract:Min seok Baek, MD1; Kyungdo Han, PhD2; Yujin Koo, MD1; Bo Kyu Choi, MD1; Han Kyu Na, MD1; Chul Hyoung Lyoo, MD, PhD1 and Hanna Cho, MD, PhD1, (1)Gangnam Severance Hospital, Yonsei University College of Medicine, Seoul, Korea, Republic of (South), (2)The Catholic University, Seoul, Korea, Republic of (South)Background: The purpose of this study is to investigate the risk of incidental Alzheimer’s disease(AD) and vascular dementia (VD) in insomnia patients using the National Health Insurance Service (NHIS) database of the entire population of South Korea from 2007 to 2014. We examined the relationship between insomnia and the risk of dementia including mortality and a long-term care facility admission of dementia patients, as well as the interaction between insomnia and known cardiovascular risks through subgroup analysis. Method: 2,796,871 patients diagnosed with insomnia (G47.0) by ICD-10 codes between 2007 to 2014 were enrolled. 5,593,742 controls were matched by a Greedy digit match algorithm. The propensity score matched analysis was done using variables that could affect the outcomes such as age, sex, hypertension, diabetes mellitus, dyslipidemia, congestive heart failure, and history of ischemic stroke. The follow-up diagnoses of AD (F00,G31.1) and VD (F01) were analysed by ICD-10 codes. The adjusted hazard ratio of mortality rate and admission to a long-term care facility was calculated with multivariable Cox analysis. Result: Among 2,796,871 insomnia patients, 138,270 patients were newly diagnosed with AD, and 26,706 patients with VD. Patients diagnosed with insomnia showed higher incidence rate than controls in both AD (Adjusted incidence rate ratio, IRR 1.73 [1.72-1.75, 95%CI]) and VD (IRR 2.1 [2.06-2.14, 95%CI]), respectively. The risk of both AD and VD in the insomnia group were higher in patients with cardiovascular risk factors. Dementia patients both in AD and VD in the insomnia group showed a higher mortality rate than the non-insomnia group (Adjusted hazard ratio, HR 1.066 [1.038-1.095,95%CI] for AD, HR 1.077 [1.011-1.147, 95%CI]). Likewise, the proportion and duration of admission to a long-term care facility is higher in dementia in the insomnia group (Adjusted hazard ratio, HR 1.242 [1.205-1.279, 95%CI] for AD, HR 1.208 [1.126-1.295, 95%CI]). Conclusion: In this study using nationwide population data, insomnia increases the risk of AD and VD. Insomnia prior to the diagnosis of dementia also affects progress in terms of mortality and a long term facility admission.",Diagnosis and Prognosis,Clinical (neuropsychiatry and behavioral neurology),[Posters Mon] Diagnosis and Prognosis： Clinical (neuropsychiatry and behavioral neurology)
P2-288,Two Novel Mutations in CSF1R Causing Hereditary Diffuse Leukoencephalopathy with Axonal Spheroids (HDLS),"Mon, Jul 15  (Pacific)",9:30am - 4:15pm,South Hall GH - Los Angeles Convention Center,https://ep70.eventpilotadmin.com/web/page.php?page=Session&project=AAIC19&id=30541,"Elizabeth B Joe, MD",MD; Danielle Feigenbaum,"
Abstract:Elizabeth B Joe, MD; Helena C Chui, MD; Danielle Feigenbaum, M.D.; Lilyana Amezcua, M.D.; Mark Lew, M.D. and John M Ringman, MD, Keck School of Medicine at University of Southern California, Los Angeles, CA, USABackground: Hereditary diffuse leukoencephalopathy with axonal spheroids (HDLS) is a neurodegenerative disease presenting in midlife and associated with rapidly progressive cognitive, behavioral and motor symptoms. HDLS results from mutations in the CSF1R gene and is inherited in an autosomal dominant pattern. Method: We describe the clinical and neuroimaging features of two cases of HDLS evaluated at our medical center.and compare them with previously reported cases. Result: Both patients had clinical genetic testing done revealing mutations in CSF1R. Patient 1 is a 46 year old woman who initially presented with gait changes and dysarthria, with rapid progression of bulbar and cognitive symptoms over 18 months, and was found to have a mutation in exon 19, c.2519C>G (p.Ser840Cys). Patient 2 is a 56 year old man presenting with 3 years of depression and memory problems without significant motor symptoms in the context of a family history of early onset dementia syndrome in his mother and prior diagnosis of HDLS in his maternal aunt; he was also found to have a mutation in exon 19, c.2480T>A (p.Ile827Asn). Both patients demonstrated extensive white matter hyperintensities and thinning of the corpus callosum on their MRIs with Patient 1 having cavitary lesions. Both mutations are located in the tyrosine kinase domain of the protein at or near the location of previously described mutations. Both mutations are predicted to be probably damaging by Polyphen with a score of 1.0. Conclusion: To our knowledge, these are the first reported cases of HDLS associated with these mutations. As has been described in the literature, the female patient had a younger age of onset than the male. Clinicians should be aware of the diversity of clinical presentations of HDLS and consider genetic testing for atypical dementia syndromes associated with significant white matter changes.",Diagnosis and Prognosis,Clinical (neuropsychiatry and behavioral neurology),[Posters Mon] Diagnosis and Prognosis： Clinical (neuropsychiatry and behavioral neurology)
P2-289,Predictors of Decline in Early Onset Alzheimer’s Dementia: A Retrospective Cohort Study,"Mon, Jul 15  (Pacific)",9:30am - 4:15pm,South Hall GH - Los Angeles Convention Center,https://ep70.eventpilotadmin.com/web/page.php?page=Session&project=AAIC19&id=30764,"Latha Velayudhan, MD",,"
Abstract:Latha Velayudhan, MD1,2; Alicear Kablan3; Sarah Baillon, PhD4; Laura McCulloch5; Samuel Tromans6 and James Lindesay, PhD2, (1)Institute of Psychiatry, Psychology and Neurosciences, King's College London, London, United Kingdom, (2)University of Leicester, Leicester, United Kingdom, (3)Institute of Psychiatry, Psychology and Neurosciences, London, United Kingdom, (4)Leicestershire Partnership NHS Trust, Leicester, United Kingdom, (5)Colchester General Hospital, Essex, United Kingdom, (6)Leicestershire partnership NHS Trust, Leicester, United KingdomBackground: Early-onset Alzheimer’s disease (AD) defined as onset of AD before the age of 65 is less common than the late-onset type and little is known about the factors affecting disease progression. We aimed to investigate demographic and cognitive measures as predictors for decline in EOAD, in individuals attending memory clinic for under 65 years of age in an European setting. Method: Subjects were consecutive patients assessed and followed up at a specialist memory service at a university teaching hospital between 2000-2010. Dementia diagnosis was made using ICD 10 criteria. Demographical measures, clinical and cognitive assessment using MMSE and CamCog at baseline were used as potential predictors of outcome at follow-up assessment at final attendance to the clinic. Outcomes was classified as those with slower decline (SD) who continued to follow up within the outpatient service or discharged back home as stable or as rapid decliners (RD) who needed transfer to other services such as community mental health team, inpatient services, placement to institutional care or death. Result: Of the 101 people (55 women; 58.9± 4.8 years) diagnosed with EOAD during this period, 26 patients had slower decline and 75 rapid decliners (69 transferred to other services, 4 to institutional care and 2 died). People with RD had lower education (p=0.021), shorter duration of illness (p=0.039), more family history of dementia (p=0.008, X2(1) = 9.57), were on antidepressants (p<0.001, X2(1) = 36.1) and not on cholinesterase inhibitor therapy (p=0.04, X2(1) = 10.07). Lower scores in orientation, attention and calculation, recent memory and abstract thinking on the CamCog test at baseline were found to predict a faster disease progression and poorer outcome.  Conclusion: Identification of predictors of faster disease progression have significant clinical benefit, allowing clinicians to estimate prognosis and plan patient care accordingly.",Diagnosis and Prognosis,Clinical (neuropsychiatry and behavioral neurology),[Posters Mon] Diagnosis and Prognosis： Clinical (neuropsychiatry and behavioral neurology)
P2-290,Comparison of Self and Informant Evaluated Korean Dementia Screening Questionnaire Cognition (KDSQ-C) for the Diagnosis of Mild Cognitive Impairment and Dementia,"Mon, Jul 15  (Pacific)",9:30am - 4:15pm,South Hall GH - Los Angeles Convention Center,https://ep70.eventpilotadmin.com/web/page.php?page=Session&project=AAIC19&id=30965,"Dong Won Yang, MD, PhD",,"
Abstract:Dong Won Yang, MD, PhD1; Ahro Kim, MD1; Dong Woo Lee, MD, PhD2; Hyun Jeong Han, MD, PhD3; Jee Hyang Jeong, MD, PhD4; Jun Hong Lee, MD5; Jun-Young Lee, MD, PhD6; Kee Hyung Park, M.D, PhD7; Kyung Won Park8; SangYun Kim, MD, PhD9; Seong Hye Choi, MD, PhD10; Young Chul Youn, MD, PhD11 and  COST Study, (1)The Catholic University of Korea, College of Medicine, Seoul St. Mary’s Hospital, Seoul, Korea, Republic of (South), (2)Inje University Snaggye Paik Hospital, Seoul, Korea, Republic of (South), (3)Myongji Hospital, Goyang, Korea, Republic of (South), (4)Ewha Womans University Mokdong Hospital, Ewha Womans University College of Medicine, Seoul, Korea, Republic of (South), (5)National Health Insurance Service Ilsan Hospital, Goyang-si, Korea, Republic of (South), (6)Seoul National University College of Medicine, Seoul, Korea, Republic of (South), (7)Gachon University Gil Medical Center, Incheon, Korea, Republic of (South), (8)Dong-A University College of Medicine, Busan, Korea, Republic of (South), (9)Clinical Neuroscience Center, Seoul National University Bundang Hospital, Seoungnam, Korea, Republic of (South), (10)Inha University School of Medicine, Incheon, Korea, Republic of (South), (11)Chung-Ang University Hospital, Seoul, Korea, Republic of (South)Background: The Korean Dementia Screening Questionnaire-Cognition (KDSQ-C) is a semi-structured questionnaire with 15 items about cognitive dysfunctions, developed to screen dementia of Korean elderly. It was originally designed to be evaluated by the informants who knew the patient very well. However, the number of the elderly living independently without family members and visiting memory clinic without informants has been increasing in Korea. We compared self and informant conducted KDSQ-C to validate self-evaluated KDSQ-C for the diagnosis of mild cognitive impairment (MCI) and dementia Method: 200 normal control, 50 MCI and 170 dementia subjects over 65 years old and their informants from 11 hospitals were recruited for this study. KDSQ-C was completed separately by participants and their informants. Mini-Mental State Examination (MMSE) was conducted by participants only. The sensitivity and specificity of KDSQ-C and the MMSE for diagnosing MCI and dementia were calculated with a receiver operating characteristic (ROC) curve. Result: The areas under the curve (AUCs) for the KDSQ-C evaluated by participants and informant for the diagnosis of dementia were 0.75 and 0.92 separately. KDSQ-C (cut-off point 6) rated by participants had a sensitivity of 50% and specificity of 77% for diagnosis of MCI and a sensitivity of 62% and specificity of 77% for diagnosis of dementia. Caregiver evaluated KDSQ-C (cut-off point 6) had a sensitivity of 70% and specificity of 79% for MCI and a sensitivity of 85% and specificity of 79% of dementia. The AUC for MMSE was 0.95 and at a cut-off score 24/25, it showed a sensitivity of 85% and specificity of 92% for the diagnosis of dementia. The AUCs for the MMSE and caregiver evaluated KDSQ-C was not different significantly (p> 0.05) to diagnose MCI or dementia. Conclusion: Informant-rated KDSQ-C had better discriminative ability than did participants-rated KDSQ-C and had similar screening power to MMSE to diagnose MCI or dementia. However, KDSQ-C can be rated by participants to screen dementia when an informant is not available. This study was supported by a 2017 grant from the National Health Insurance Service",Diagnosis and Prognosis,Clinical (neuropsychiatry and behavioral neurology),[Posters Mon] Diagnosis and Prognosis： Clinical (neuropsychiatry and behavioral neurology)
P2-291,Head Turn Sign. Highly Simply and Specific for Dementia Diagnosis,"Mon, Jul 15  (Pacific)",9:30am - 4:15pm,South Hall GH - Los Angeles Convention Center,https://ep70.eventpilotadmin.com/web/page.php?page=Session&project=AAIC19&id=31067,"Santiago O´Neill, MD",,"
Abstract:Santiago O´Neill, MD1; Noelia Pontello2; Corina Christie2; Florencia Vallejos, MD3 and Galeno Rojas, MD3, (1)Neuroscience Institute Favaloro Foundation, Buenos Aires, Argentina,, CABA, Argentina, (2)Neuroscience Institute Favaloro Foundation, Buenos Aires, Argentina, (3)Neuroscience Institute Favaloro Foundation, Buenos Aires, Argentina,, Buenos Aires, ArgentinaBackground: In the complementary test era for the diagnosis of dementia, certain clinical indicators may still be useful. The s head turn sign (HTS) is the movement that the patient performs before a specific question of the examiner looking for the answer in the partner. The objective of the study is to evaluate the HTS sign and its capacity for the diagnosis of dementia in a cognitive neurology consultation Method: A prospective cross-sectional observational study was conducted in patients who attended to a cognitive neurology service. The HTS was evaluated in these patients when asked about the current age. The presence of dementia was determined according to the NIA-AA clinical criteria and the probable etiologic diagnoses was classified as degenerative or non-degenerative. The Folstein minimental state (MMSE) was administered to the evaluated patients. The epi info 7.2.1 was used for the statistical analysis Result: Total 150 patients were evaluated, mean age 76 (SD 8.6). 48% had a clinical diagnosis of dementia, with degenerative disease being the cause in 66%. The HTS had a sensitivity of 41.7% and a specificity of 97% for the diagnosis of dementia, presenting a positive predictive value of 93.7% and a negative predictive value of 64.4%. Those who presented positive HTS had a higher risk of degenerative disease with OR 10.5 95% CI 1.36-81. (p = 0.003). The positive HTS was associated with a lower MMSE (Mean 19.22 DS 2.1 versus negative HTS 23.44 DS 5) (p = 0.0037) Conclusion: Consistent with some previous ones, the HTS showed to be a simple and highly specific assessment for the diagnosis of dementia, so its administration is potentially very useful to include in patients evaluation",Diagnosis and Prognosis,Clinical (neuropsychiatry and behavioral neurology),[Posters Mon] Diagnosis and Prognosis： Clinical (neuropsychiatry and behavioral neurology)
P2-292,The Pattern of Inheritance in Early Onset Alzheimer’s Disease and Frontotemporal Dementia,"Mon, Jul 15  (Pacific)",9:30am - 4:15pm,South Hall GH - Los Angeles Convention Center,https://ep70.eventpilotadmin.com/web/page.php?page=Session&project=AAIC19&id=31074,"Gorana Mandic Stojmenovic, MD",,"
Abstract:Gorana Mandic Stojmenovic, MD1; Elka Stefanova, MD, PhD1,2; Ivana Novakovic, MD, PhD1,2; Valerija Dobricic, PhD3; Tanja Stojkovic, MD1 and Vladimir S Kostic, MD, PhD1,2, (1)Neurology Clinic, Clinical Center of Serbia, Belgrade, Serbia, (2)University of Belgrade, School of Medicine, Belgrade, Serbia, (3)University of Lübeck, Lübeck, GermanyBackground: Early-onset dementia (EOD) is conventionally considered to include patients with disease onset before 65 years of age. Alzheimer’s disease (AD) and Frontotemporal dementia (FTD) are two most common forms of degenerative EOD. Our aim was to investigate the patterns of inheritance and gene mutation status in consecutive degenerative EOD patients. Method: Two hundred and seven consecutive patients diagnosed according to the current clinical criteria for AD and FTD spectrum were recruited from the Neurology Clinic, Clinical Centre of Serbia from 01.04.2012. until 01.04.2017. Result: One third of AD and FTD patients had familial form of dementia, while the autosomal dominant inheritance pattern existed in 4.7% and 7.7% of probands with AD and FTD, respectively. The gene mutations were identified in 7.3% familial AD (a third of AD patients with autosomal dominant inheritance pattern) and in 1.2% sporadic AD patients; 25% familial FTD patients were gene mutation carriers (half of FTD patients with autosomal dominant inheritance pattern) along with 7% of sporadic FTD patients. Only 3.1% of the total population of AD and 10.3% of FTD possessed known gene mutations. Conclusion: EOD does not appear to be a strongly inherited autosomal dominant condition. The majority of patients were sporadic. Common gene mutations do not explain the total autosomal dominant burden.",Diagnosis and Prognosis,Clinical (neuropsychiatry and behavioral neurology),[Posters Mon] Diagnosis and Prognosis： Clinical (neuropsychiatry and behavioral neurology)
P2-293,An Investigation of Various Cardiovascular Risk Factors and Their Effects on Intra-Individual Cognitive  Variability.,"Mon, Jul 15  (Pacific)",9:30am - 4:15pm,South Hall GH - Los Angeles Convention Center,https://ep70.eventpilotadmin.com/web/page.php?page=Session&project=AAIC19&id=31098,"Shenikqua Bouges, MD",,"
Abstract:Shenikqua Bouges, MD1,2; Emre Umucu, PhD3; Derek L. Norton, MS1,4,5; Nathaniel A. Chin, MD4,6; Mary F. Wyman, PhD1,7; Nickolas Lambrou, PhD2; Megan Zuelsdorff, PhD2; Susan Flowers Benton, PhD, CRC1; John O'Hara, M.A.2; Cynthia Carlsson, MS, MD2,4,5,6 and Carey E. Gleason, PhD2,4, (1)University of Wisconsin School of Medicine & Public Health, Madison, WI, USA, (2)VA Geriatric Research, Education and Clinical Center (GRECC), William S. Middleton Memorial Veterans Hospital, Madison, WI, USA, (3)University of Texas, El Paso, El Paso, TX, USA, (4)Wisconsin Alzheimer's Disease Research Center, University of Wisconsin School of Medicine and Public Health, Madison, WI, USA, (5)Wisconsin Alzheimer's Institute, University of Wisconsin School of Medicine and Public Health, Madison, WI, USA, (6)University of Wisconsin School of Medicine and Public Health, Madison, WI, USA, (7)Geriatric Research, Education, and Clinical Center, W.S. Middleton Memorial Veterans Hospital, Madison, WI, USABackground:",Diagnosis and Prognosis,Clinical (neuropsychiatry and behavioral neurology),[Posters Mon] Diagnosis and Prognosis： Clinical (neuropsychiatry and behavioral neurology)
P2-294,Retrospective Review of Clinical Features of ABCA7 Loss-of-Function Mutation Carriers in Late-Onset Alzheimer's Disease,"Mon, Jul 15  (Pacific)",9:30am - 4:15pm,South Hall GH - Los Angeles Convention Center,https://ep70.eventpilotadmin.com/web/page.php?page=Session&project=AAIC19&id=31103,Alana Stephens DO,PhD; Merve Atik; Sarah J. Lincoln,"
Abstract:Alana Stephens DO; Mariet Allen, PhD; Merve Atik; Sarah J. Lincoln, BSc; Kimberly G. Malphrus, BS; Thuy Nguyen, BS; Morgane M. Corda; Olivia J. Conway; Neill R. Graff-Radford, MD; Dennis W. Dickson, MD and Nilufer Ertekin-Taner, MD, PhD, Mayo Clinic, Jacksonville, FL, USABackground: Genome-wide association studies (GWAS) have identified association of common variants at the ABCA7 locus with risk for late-onset Alzheimer’s disease (LOAD). Subsequent sequencing studies identified increased burden of ABCA7 putative loss-of-function (pLOF) variants in LOAD patients compared with controls. Similar findings have been reported for Parkinson’s disease (PD), and other neurodegenerative pathologies, implicating a potential role for ABCA7 across multiple neurodegenerative conditions. Clinical features of ABCA7 pLOF mutation carriers have yet to be explored extensively. We hypothesize there may be distinguishing clinical features of ABCA7 pLOF mutation carriers, and that some of these features may be mutation specific. Method: Genotypes were performed on 3,284 participants from Mayo Clinic Florida for 6 reported ABCA7 pLOF variants (p.E709fs, p.Trp1214X, p.L1403fs, c.4416+2T>G, p.E1679X, c.5570+5G>C). A neurology resident, blinded to the pLOF variants, performed a retrospective chart review on 43 mutation-carriers with available clinical data, for demographics, clinical features and available test results. Result: Of the 6 genotyped mutations, observed counts ranged from 1 to 24 individuals. Overall, 20/43 mutation carriers were male, and 23/43 were female. Twenty had advanced dementia, 10 had mild to moderate AD, 5 had mild cognitive impairment, 3 had alternative neurodegenerative diagnoses (Lewy body, PD, corticobasal degeneration), and 6 had no cognitive deficits. The average age of symptom onset was 66.15 years, ranging from 52-75, amongst dementia patients. Individuals with the earliest age of onset had atypical features including posterior cortical atrophy, primary progressive aphasia, behavioral changes, or extrapyramidal findings. Depression was more common amongst carriers of the four least frequent mutations (8/10), when compared to the two most frequent mutations (13/33). The prevalence of additional selected clinical features will be compared between mutation carriers and the broader cohort to identify additional differentiating features. Conclusion: Studies of pLOF variants at the ABCA7 locus show increased risk for LOAD. Our in-depth clinical review of this cohort suggests that certain variants have an early onset of atypical symptoms and have other differentiating features. Identifying clinical features associated with specific genetic risk factors may provide novel insights into the pathophysiology of the disease and enable patient classification relevant for biomarker studies and clinical trials.",Diagnosis and Prognosis,Clinical (neuropsychiatry and behavioral neurology),[Posters Mon] Diagnosis and Prognosis： Clinical (neuropsychiatry and behavioral neurology)
P2-295,Fluctuating Cognition in Non Lewy Body Dementia and Its Clinical Implication,"Mon, Jul 15  (Pacific)",9:30am - 4:15pm,South Hall GH - Los Angeles Convention Center,https://ep70.eventpilotadmin.com/web/page.php?page=Session&project=AAIC19&id=31135,"Po-Ya Cheng, MS",,"
Abstract:Po-Ya Cheng, MS1; Cheng-Yu Wei, MD, MS2 and Pai-Yi Chiu, PhD1, (1)Show Chwan Memorial Hospital, Changhwa, Taiwan, (2)Chang Bing Show Chwan Memorial Hospital, Changhwa, TaiwanBackground:",Diagnosis and Prognosis,Clinical (neuropsychiatry and behavioral neurology),[Posters Mon] Diagnosis and Prognosis： Clinical (neuropsychiatry and behavioral neurology)
P2-296,Decision Making Time in Patients with Mild Cognitive Impairment and Dementia Assessed with Simple Reaction Time and Go/No-Go Task,"Mon, Jul 15  (Pacific)",9:30am - 4:15pm,South Hall GH - Los Angeles Convention Center,https://ep70.eventpilotadmin.com/web/page.php?page=Session&project=AAIC19&id=31403,"Valentin Bragin, M.D.",M.S.; David Kalancha; Tanya Silenko and Sally Nozadze,"
Abstract:Valentin Bragin, M.D.; Nicole Lashiker, M.S.; David Kalancha; Tanya Silenko and Sally Nozadze, Stress Relief and Memory Training Center, Brooklyn, NY, USABackground:",Diagnosis and Prognosis,Clinical (neuropsychiatry and behavioral neurology),[Posters Mon] Diagnosis and Prognosis： Clinical (neuropsychiatry and behavioral neurology)
